{
  "schema_version": 1,
  "kind": "forum.discussions",
  "data": [
    {
      "id": "1",
      "name": "第一次作業的常見問題",
      "forum_id": "2",
      "author": "Tammy Teacher",
      "last_author": "Sam Student",
      "created_at": "2026-09-18T09:27:19Z",
      "modified_at": "2026-09-18T09:27:19Z",
      "replies": 1,
      "unread": 0,
      "pinned": false,
      "locked": false,
      "can_reply": true
    }
  ],
  "meta": {
    "site": "rec",
    "account": "env",
    "source": "ws",
    "partial": false,
    "missing": [],
    "next_cursor": null
  }
}
